{
  "schemaVersion": "m1.readiness-artifact.v1",
  "testCode": "ARC-007",
  "command": "PATH=/private/tmp/pg15-build-20260808/install/bin:$PATH psql -h /private/tmp/m1-pg-socket-20260808 -p 55432 -d m1_ARC_007 -v ON_ERROR_STOP=1 -f schema/postgres/test/008_m1_source_archive_fixtures.sql",
  "result": "passed",
  "verified": true,
  "verifiedAt": "2026-08-08T05:26:01Z",
  "runtime": {
    "name": "postgresql",
    "version": "15.18"
  },
  "testPaths": [
    "schema/postgres/test/008_m1_source_archive_fixtures.sql"
  ],
  "stdoutPath": "evidence/m1/ARC-007.stdout.log",
  "stdoutSha256": "068d8a94039e34468dbfeaaa04b7cadd84dd0eb69e8c2c2cd468383395ed0a56",
  "commandExitStatus": 0,
  "runner": "scripts/record_m1_readiness_evidence.rb"
}
