{
  "schemaVersion": "m1.readiness-artifact.v1",
  "testCode": "CTR-008",
  "command": "PATH=/private/tmp/pg15-build-20260808/install/bin:$PATH psql -h /private/tmp/m1-pg-socket-20260808 -p 55432 -d m1_ctr008 -v ON_ERROR_STOP=1 -f schema/postgres/test/003_test_governance_fixtures.sql",
  "result": "passed",
  "verified": true,
  "verifiedAt": "2026-08-08T05:16:05Z",
  "runtime": {
    "name": "postgresql",
    "version": "15.18"
  },
  "testPaths": [
    "schema/postgres/test/003_test_governance_fixtures.sql"
  ],
  "stdoutPath": "evidence/m1/CTR-008.stdout.log",
  "stdoutSha256": "97f8b60c4fffd16aa23a63a37a4b65c09662f94bb6d44aa4d9e34b5352b3c8c4",
  "commandExitStatus": 0,
  "runner": "scripts/record_m1_readiness_evidence.rb"
}
