{
  "schemaVersion": "m1.readiness-artifact.v1",
  "testCode": "GOV-016",
  "command": "PATH=/private/tmp/pg15-build-20260808/install/bin:$PATH psql -h /private/tmp/m1-pg-socket-20260808 -p 55432 -d m1_gov016 -v ON_ERROR_STOP=1 -f schema/postgres/test/003_test_governance_fixtures.sql && PATH=/private/tmp/pg15-build-20260808/install/bin:$PATH psql -h /private/tmp/m1-pg-socket-20260808 -p 55432 -d m1_gov016 -v ON_ERROR_STOP=1 -f schema/postgres/test/004_gate_evaluation_fixtures.sql",
  "result": "passed",
  "verified": true,
  "verifiedAt": "2026-08-08T05:17:21Z",
  "runtime": {
    "name": "postgresql",
    "version": "15.18"
  },
  "testPaths": [
    "schema/postgres/test/003_test_governance_fixtures.sql",
    "schema/postgres/test/004_gate_evaluation_fixtures.sql"
  ],
  "stdoutPath": "evidence/m1/GOV-016.stdout.log",
  "stdoutSha256": "72aabc18951fe55d3974cc5698fd151a4a39fac060a1c5b22d73b629a8a9f007",
  "commandExitStatus": 0,
  "runner": "scripts/record_m1_readiness_evidence.rb"
}
