{
  "schemaVersion": "m1.readiness-artifact.v1",
  "testCode": "CTR-004",
  "command": "PATH=/private/tmp/pg15-build-20260808/install/bin:$PATH psql -h /private/tmp/m1-pg-socket-20260808 -p 55432 -d m1_ctr004 -v ON_ERROR_STOP=1 -f schema/postgres/test/005_event_base_fixtures.sql",
  "result": "passed",
  "verified": true,
  "verifiedAt": "2026-08-08T04:41:19Z",
  "runtime": {
    "name": "postgresql",
    "version": "15.18"
  },
  "testPaths": [
    "schema/postgres/test/005_event_base_fixtures.sql"
  ],
  "stdoutPath": "evidence/m1/CTR-004.stdout.log",
  "stdoutSha256": "2053d471ea6a4b74c98f87a8b608e6e863d45b030d2f4b00d01a532c52757543",
  "commandExitStatus": 0,
  "runner": "scripts/record_m1_readiness_evidence.rb"
}
