{
  "schemaVersion": "m1.readiness-artifact.v1",
  "testCode": "CTR-014",
  "command": "PATH=/private/tmp/pg15-build-20260808/install/bin:$PATH psql -h /private/tmp/m1-pg-socket-20260808 -p 55432 -d m1_ctr014 -v ON_ERROR_STOP=1 -f schema/postgres/test/020_presentation_fixtures.sql",
  "result": "passed",
  "verified": true,
  "verifiedAt": "2026-08-08T04:29:13Z",
  "runtime": {
    "name": "postgresql",
    "version": "15.18"
  },
  "testPaths": [
    "schema/postgres/test/020_presentation_fixtures.sql"
  ],
  "stdoutPath": "evidence/m1/CTR-014.stdout.log",
  "stdoutSha256": "34b589cf1af4b4c1dca84caa36df14cfb60e39080f35cae365e1f3e8a5cfa8e5",
  "commandExitStatus": 0,
  "runner": "scripts/record_m1_readiness_evidence.rb"
}
