{
  "schemaVersion": "m1.readiness-artifact.v1",
  "testCode": "CTR-005",
  "command": "PATH=/private/tmp/pg15-build-20260808/install/bin:$PATH psql -h /private/tmp/m1-pg-socket-20260808 -p 55432 -d m1_ctr005 -v ON_ERROR_STOP=1 -f schema/postgres/test/003_test_governance_fixtures.sql && PATH=/private/tmp/pg15-build-20260808/install/bin:$PATH psql -h /private/tmp/m1-pg-socket-20260808 -p 55432 -d m1_ctr005 -v ON_ERROR_STOP=1 -f schema/postgres/test/007_manifest_import_fixtures.sql",
  "result": "passed",
  "verified": true,
  "verifiedAt": "2026-08-08T05:15:32Z",
  "runtime": {
    "name": "postgresql",
    "version": "15.18"
  },
  "testPaths": [
    "schema/postgres/test/003_test_governance_fixtures.sql",
    "schema/postgres/test/007_manifest_import_fixtures.sql"
  ],
  "stdoutPath": "evidence/m1/CTR-005.stdout.log",
  "stdoutSha256": "ec80c059df9bcaba698a72d04d61f7c2ec15e09fb666d46c3e465ea153969cc2",
  "commandExitStatus": 0,
  "runner": "scripts/record_m1_readiness_evidence.rb"
}
