{
  "schemaVersion": "m1.readiness-artifact.v1",
  "testCode": "CTR-011",
  "command": "PATH=/private/tmp/pg15-build-20260808/install/bin:$PATH psql -h /private/tmp/m1-pg-socket-20260808 -p 55432 -d m1_ctr011 -v ON_ERROR_STOP=1 -f schema/postgres/test/003_test_governance_fixtures.sql && PATH=/private/tmp/pg15-build-20260808/install/bin:$PATH psql -h /private/tmp/m1-pg-socket-20260808 -p 55432 -d m1_ctr011 -v ON_ERROR_STOP=1 -f schema/postgres/test/007_manifest_import_fixtures.sql && PATH=/private/tmp/pg15-build-20260808/install/bin:$PATH psql -h /private/tmp/m1-pg-socket-20260808 -p 55432 -d m1_ctr011 -v ON_ERROR_STOP=1 -f schema/postgres/test/015_inherited_catalog_fixtures.sql",
  "result": "passed",
  "verified": true,
  "verifiedAt": "2026-08-08T05:18:45Z",
  "runtime": {
    "name": "postgresql",
    "version": "15.18"
  },
  "testPaths": [
    "schema/postgres/test/003_test_governance_fixtures.sql",
    "schema/postgres/test/007_manifest_import_fixtures.sql",
    "schema/postgres/test/015_inherited_catalog_fixtures.sql"
  ],
  "stdoutPath": "evidence/m1/CTR-011.stdout.log",
  "stdoutSha256": "c7351f110a4ae0daca2bf0fbe1dcb4ef0a32ea0b108c71e10b156043d2f59e17",
  "commandExitStatus": 0,
  "runner": "scripts/record_m1_readiness_evidence.rb"
}
