{
  "schemaVersion": "m1.readiness-artifact.v1",
  "testCode": "CTR-007",
  "command": "PATH=/private/tmp/pg15-build-20260808/install/bin:$PATH psql -h /private/tmp/m1-pg-socket-20260808 -p 55432 -d m1_ctr007 -v ON_ERROR_STOP=1 -f schema/postgres/test/003_test_governance_fixtures.sql && PATH=/private/tmp/pg15-build-20260808/install/bin:$PATH psql -h /private/tmp/m1-pg-socket-20260808 -p 55432 -d m1_ctr007 -v ON_ERROR_STOP=1 -f schema/postgres/test/017_test_definition_strength_fixtures.sql && PATH=/private/tmp/pg15-build-20260808/install/bin:$PATH psql -h /private/tmp/m1-pg-socket-20260808 -p 55432 -d m1_ctr007 -v ON_ERROR_STOP=1 -f schema/postgres/test/024_test_governance_signature_fixtures.sql",
  "result": "passed",
  "verified": true,
  "verifiedAt": "2026-08-08T04:39:01Z",
  "runtime": {
    "name": "postgresql",
    "version": "15.18"
  },
  "testPaths": [
    "schema/postgres/test/003_test_governance_fixtures.sql",
    "schema/postgres/test/017_test_definition_strength_fixtures.sql",
    "schema/postgres/test/024_test_governance_signature_fixtures.sql"
  ],
  "stdoutPath": "evidence/m1/CTR-007.stdout.log",
  "stdoutSha256": "ab16aa4f513f9608c469346cf2ec2f2577271753b98ca9fdb45fe700589db7a4",
  "commandExitStatus": 0,
  "runner": "scripts/record_m1_readiness_evidence.rb"
}
